{
  "schema_version": 1,
  "trace_id": "00000000-0000-4000-8000-000000000001",
  "table_id": "fixture-only",
  "hand": 3,
  "state_version": 12,
  "status": "completed",
  "started_at": "2026-10-25T00:00:00.000Z",
  "ended_at": "2026-10-25T00:00:01.260Z",
  "duration_ms": 1260,
  "langsmith_url": null,
  "spans": [
    {
      "span_id": "00000000-0000-4000-8000-000000000001",
      "parent_span_id": null,
      "name": "decision",
      "kind": "chain",
      "status": "completed",
      "started_at": "2026-10-25T00:00:00.000Z",
      "ended_at": "2026-10-25T00:00:01.260Z",
      "start_offset_ms": 0,
      "duration_ms": 1260,
      "inputs": {
        "hand": 3,
        "state_version": 12
      },
      "outputs": {
        "action": "check"
      },
      "model": null,
      "usage": null,
      "error": null,
      "metadata": {
        "synthetic_fixture": true
      }
    },
    {
      "span_id": "00000000-0000-4000-8000-000000000002",
      "parent_span_id": "00000000-0000-4000-8000-000000000001",
      "name": "assess_hand",
      "kind": "tool",
      "status": "completed",
      "started_at": "2026-10-25T00:00:00.012Z",
      "ended_at": "2026-10-25T00:00:00.252Z",
      "start_offset_ms": 12,
      "duration_ms": 240,
      "inputs": {
        "hole": [
          "As",
          "Js"
        ],
        "board": [
          "Ks",
          "7s",
          "2d"
        ]
      },
      "outputs": {
        "assumption": "Synthetic fixture, no actual calculation."
      },
      "model": null,
      "usage": null,
      "error": null,
      "metadata": {
        "synthetic_fixture": true
      }
    },
    {
      "span_id": "00000000-0000-4000-8000-000000000003",
      "parent_span_id": "00000000-0000-4000-8000-000000000001",
      "name": "retrieve_evidence",
      "kind": "retriever",
      "status": "completed",
      "started_at": "2026-10-25T00:00:00.004Z",
      "ended_at": "2026-10-25T00:00:00.034Z",
      "start_offset_ms": 4,
      "duration_ms": 30,
      "inputs": {
        "opponent_seats": [
          1,
          2
        ]
      },
      "outputs": {
        "evidence": []
      },
      "model": null,
      "usage": null,
      "error": null,
      "metadata": {
        "synthetic_fixture": true
      }
    },
    {
      "span_id": "00000000-0000-4000-8000-000000000004",
      "parent_span_id": "00000000-0000-4000-8000-000000000001",
      "name": "choose_action",
      "kind": "chain",
      "status": "completed",
      "started_at": "2026-10-25T00:00:00.260Z",
      "ended_at": "2026-10-25T00:00:01.250Z",
      "start_offset_ms": 260,
      "duration_ms": 990,
      "inputs": {
        "legal_actions": [
          "check",
          "raise:40"
        ]
      },
      "outputs": {
        "action": "check"
      },
      "model": null,
      "usage": null,
      "error": null,
      "metadata": {
        "synthetic_fixture": true
      }
    },
    {
      "span_id": "00000000-0000-4000-8000-000000000005",
      "parent_span_id": "00000000-0000-4000-8000-000000000004",
      "name": "model_call",
      "kind": "llm",
      "status": "completed",
      "started_at": "2026-10-25T00:00:00.268Z",
      "ended_at": "2026-10-25T00:00:01.218Z",
      "start_offset_ms": 268,
      "duration_ms": 950,
      "inputs": {
        "messages": [
          {
            "role": "user",
            "content": "Synthetic development fixture only."
          }
        ]
      },
      "outputs": {
        "action": "check",
        "summary": "Illustrative output, not an actual model decision."
      },
      "model": "fixture/model",
      "usage": {
        "input_tokens": 100,
        "output_tokens": 50,
        "cost_usd": null
      },
      "error": null,
      "metadata": {
        "synthetic_fixture": true
      }
    },
    {
      "span_id": "00000000-0000-4000-8000-000000000006",
      "parent_span_id": "00000000-0000-4000-8000-000000000004",
      "name": "validate_response",
      "kind": "tool",
      "status": "completed",
      "started_at": "2026-10-25T00:00:01.220Z",
      "ended_at": "2026-10-25T00:00:01.235Z",
      "start_offset_ms": 1220,
      "duration_ms": 15,
      "inputs": {
        "action": "check"
      },
      "outputs": {
        "valid": true
      },
      "model": null,
      "usage": null,
      "error": null,
      "metadata": {
        "synthetic_fixture": true
      }
    }
  ],
  "metadata": {
    "synthetic_fixture": true,
    "description": "Development fixture only. Not a measured run or live gameplay."
  }
}
